{
  "normalization_closure_decision_id": "ipc-residual-closure-v0.1",
  "instrument_version": "0.5.0-draft",
  "closure_amendment": {
    "path": "domain-universe/NORMALIZATION_CLOSURE_AMENDMENT.md",
    "sha256": "edc324516ffe98888e0621f1d47ff019b6ca33c7d7ebc9266f32613b3e7a6570"
  },
  "normalization_codebook": {
    "path": "domain-universe/NORMALIZATION_CODEBOOK.md",
    "sha256": "bc0f2d62c8b6219911b759e8a69332021cb471167a9e3fdbc6a4b5b8918b69e4"
  },
  "predecessor_record": {
    "path": "domain-universe/normalization/residuals/ipc-residual-clarification-v0.1.json",
    "sha256": "610e36a5776bacd423fed1d926ee13c32f2eff2c98a9f4a523abc6bed59b083a"
  },
  "procedure": "successor_normalization_closure",
  "status": "complete",
  "decisions": [
    {
      "closure_decision_entry_id": "ipc-A99-closure",
      "source_frame_id": "wipo-ipc-2026-01",
      "source_extraction": {
        "path": "domain-universe/extractions/wipo-ipc-2026-01-class.json",
        "sha256": "e8cf7903547eb245a2e4447b1221aa73df541c1da4a748e5127a232a87efe33c"
      },
      "source_entry_id": "ipc-A99",
      "predecessor_assessment_id": "ipc-A99-residual-clarification",
      "predecessor_result": "unresolved",
      "semantic_sufficiency": true,
      "coherent_substantive_locus": false,
      "topic_preserving_materialization_possible": false,
      "research_universe_incompatibility_established": false,
      "final_normalization_disposition": "excluded_non_materializable",
      "candidate_contribution": "none",
      "rationale": "The frozen A99 predecessor is semantically sufficient for closure because it distinguishes the section-relative residual placement rule from a positive technical locus. It preserves the D1 finding that no coherent locus exists across Section A's distinct human-necessity areas. Materializing one candidate would require selecting a narrower area or replacing the residual envelope with the broad Section A indication, neither of which the predecessor supports. D1 contains no affirmative strict out-of-scope finding; the failure established here concerns materialization, not research-universe exclusion.",
      "uncertainty": "A future concrete subject placed in A99Z might support a separately assessed locus, but this class-level decision neither evaluates such subject matter nor proves the underlying world in scope. Future finer-grained treatment and research-universe compatibility remain open questions."
    },
    {
      "closure_decision_entry_id": "ipc-B99-closure",
      "source_frame_id": "wipo-ipc-2026-01",
      "source_extraction": {
        "path": "domain-universe/extractions/wipo-ipc-2026-01-class.json",
        "sha256": "e8cf7903547eb245a2e4447b1221aa73df541c1da4a748e5127a232a87efe33c"
      },
      "source_entry_id": "ipc-B99",
      "predecessor_assessment_id": "ipc-B99-residual-clarification",
      "predecessor_result": "unresolved",
      "semantic_sufficiency": true,
      "coherent_substantive_locus": false,
      "topic_preserving_materialization_possible": false,
      "research_universe_incompatibility_established": false,
      "final_normalization_disposition": "excluded_non_materializable",
      "candidate_contribution": "none",
      "rationale": "The frozen B99 record states both what the residual place means and why its multipart performing-operations and transporting context is not a positive common technical characteristic. The D1 coherent-locus judgment therefore remains false. A single candidate could be produced only by choosing part of the residual envelope, synthesizing its potentially diverse contents into a false unity, or substituting the Section B title. None is topic preserving. D1 makes no strict boundary-incompatibility finding, so this is a materialization decision rather than out-of-scope exclusion.",
      "uncertainty": "Particular future B99Z contents could warrant separate treatment, but they are not identified in the frozen predecessor. This decision does not determine their value, future finer-grained classification, or ultimate research-universe compatibility."
    },
    {
      "closure_decision_entry_id": "ipc-C99-closure",
      "source_frame_id": "wipo-ipc-2026-01",
      "source_extraction": {
        "path": "domain-universe/extractions/wipo-ipc-2026-01-class.json",
        "sha256": "e8cf7903547eb245a2e4447b1221aa73df541c1da4a748e5127a232a87efe33c"
      },
      "source_entry_id": "ipc-C99",
      "predecessor_assessment_id": "ipc-C99-residual-clarification",
      "predecessor_result": "unresolved",
      "semantic_sufficiency": true,
      "coherent_substantive_locus": false,
      "topic_preserving_materialization_possible": false,
      "research_universe_incompatibility_established": false,
      "final_normalization_disposition": "excluded_non_materializable",
      "candidate_contribution": "none",
      "rationale": "The C99 predecessor is sufficient to separate its negative remainder function from any positive chemistry-or-metallurgy locus: even the available Section C scope notes do not unify the unallocated remainder. The inherited coherent-locus value is therefore false. Candidate materialization would require selecting one residual subject, inventing a shared locus across heterogeneous contents, or broadening C99 to the whole Section C title. The predecessor supports none of those operations and supplies no affirmative evidence of strict research-universe incompatibility.",
      "uncertainty": "A concrete residual chemical or metallurgical subject could later be assessed on its own evidence. The class-level closure does not determine such future content, establish that all underlying subjects are in scope, or authorize finer-grained re-extraction."
    },
    {
      "closure_decision_entry_id": "ipc-D99-closure",
      "source_frame_id": "wipo-ipc-2026-01",
      "source_extraction": {
        "path": "domain-universe/extractions/wipo-ipc-2026-01-class.json",
        "sha256": "e8cf7903547eb245a2e4447b1221aa73df541c1da4a748e5127a232a87efe33c"
      },
      "source_entry_id": "ipc-D99",
      "predecessor_assessment_id": "ipc-D99-residual-clarification",
      "predecessor_result": "unresolved",
      "semantic_sufficiency": true,
      "coherent_substantive_locus": false,
      "topic_preserving_materialization_possible": false,
      "research_universe_incompatibility_established": false,
      "final_normalization_disposition": "excluded_non_materializable",
      "candidate_contribution": "none",
      "rationale": "The frozen D99 assessment explains that textile terminology does not positively define the residual place and that its remainder can span distinct textile and paper subject matter. That is sufficient for the closure question while preserving the false coherent-locus judgment. One candidate would require selecting only part of the remainder, imposing a unity absent from D1, or substituting the broader Section D title. Because D1 records no strict out-of-scope evidence, the established defect is non-materializability rather than research-universe incompatibility.",
      "uncertainty": "No specific D99Z technical content is assessed here. Future concrete contents, possible finer-grained loci, and substantive boundary compatibility remain unresolved beyond this registered class-level source entry."
    },
    {
      "closure_decision_entry_id": "ipc-E99-closure",
      "source_frame_id": "wipo-ipc-2026-01",
      "source_extraction": {
        "path": "domain-universe/extractions/wipo-ipc-2026-01-class.json",
        "sha256": "e8cf7903547eb245a2e4447b1221aa73df541c1da4a748e5127a232a87efe33c"
      },
      "source_entry_id": "ipc-E99",
      "predecessor_assessment_id": "ipc-E99-residual-clarification",
      "predecessor_result": "unresolved",
      "semantic_sufficiency": true,
      "coherent_substantive_locus": false,
      "topic_preserving_materialization_possible": false,
      "research_universe_incompatibility_established": false,
      "final_normalization_disposition": "excluded_non_materializable",
      "candidate_contribution": "none",
      "rationale": "Although Section E has a compact indication, the E99 predecessor expressly distinguishes that indication from the residual place's negative closest-relation rule and finds no positive fixed-construction function or object common to its possible contents. The coherent-locus value remains false. Materializing a candidate would require replacing E99 with the section title or inventing a narrower function or object. D1 does not support either operation and contains no affirmative strict boundary-exclusion finding, so the closure concerns materialization only.",
      "uncertainty": "Specific future E99Z contents could yield a narrower locus under a separate method. This decision does not claim that no valuable fixed-construction subject exists, resolve future granularity, or prove research-universe inclusion."
    },
    {
      "closure_decision_entry_id": "ipc-F99-closure",
      "source_frame_id": "wipo-ipc-2026-01",
      "source_extraction": {
        "path": "domain-universe/extractions/wipo-ipc-2026-01-class.json",
        "sha256": "e8cf7903547eb245a2e4447b1221aa73df541c1da4a748e5127a232a87efe33c"
      },
      "source_entry_id": "ipc-F99",
      "predecessor_assessment_id": "ipc-F99-residual-clarification",
      "predecessor_result": "unresolved",
      "semantic_sufficiency": true,
      "coherent_substantive_locus": false,
      "topic_preserving_materialization_possible": false,
      "research_universe_incompatibility_established": false,
      "final_normalization_disposition": "excluded_non_materializable",
      "candidate_contribution": "none",